{
  "schema_version": "commerce-taxonomy-admission-audit-v1",
  "feature_id": "PROTO-F260909053820-Commerce-Taxonomy-Expansion",
  "projection_kind": "FoundationProjection",
  "candidate_facts_digest": "b9eff7535f4758dee499839c4a420adad4877491e471f93d55324594703369b1",
  "candidate_registry_digest": "22f92f810856a1ae7df8d5f3ec2cd67a590e834deda6174dfcc9351bd9286f51",
  "metadata_digest": "ce7c546975cd2e213c27c97c9a3adc733524adb218e3c4f19ec4993d573e98ad",
  "source_mapping_digest": "8a2b14007a64aa69a34464c5bfd2718c96a3ba498d35e5b0aa4533cf6a83a518",
  "source_snapshot_digest": "2ce8f58e0b3587fe09e62b5935053d8b7747192cb12a5ffc5d04c7edc2643011",
  "evidence_export_digest": null,
  "scan_roots": [
    "taxonomy/commerce-product-candidates-v1.json",
    "taxonomy/source-mappings/warehouse-commerce-v1.json",
    "taxonomy/evidence/commerce-product-admission-v1.json"
  ],
  "candidate_count": 272,
  "admitted_count": 0,
  "deferred_count": 272,
  "public_delta": {
    "changed": false,
    "node_count": 515,
    "tree_digest": "89962555f76a41af9c2b6d213dd0241c28214d50ec8185af9d2efb0fe28934b2"
  },
  "decisions": [
    {
      "category_id": "arts_entertainment.movies_films.film_video_media",
      "tier": "decomposition",
      "status": "deferred",
      "reason": "EVIDENCE_RECORD_MISSING",
      "evidence": null
    },
    {
      "category_id": "arts_entertainment.music_audio.musical_instruments",
      "tier": "decomposition",
      "status": "deferred",
      "reason": "EVIDENCE_RECORD_MISSING",
      "evidence": null
    },
    {
      "category_id": "arts_entertainment.music_audio.musical_instruments.musical_instrument_accessories",
      "tier": "decomposition",
      "status": "deferred",
      "reason": "EVIDENCE_RECORD_MISSING",
      "evidence": null
    },
    {
      "category_id": "arts_entertainment.music_audio.recorded_music",
      "tier": "decomposition",
      "status": "deferred",
      "reason": "EVIDENCE_RECORD_MISSING",
      "evidence": null
    },
    {
      "category_id": "automotive.vehicle_parts_accessories.automotive_batteries",
      "tier": "decomposition",
      "status": "deferred",
      "reason": "EVIDENCE_RECORD_MISSING",
      "evidence": null
    },
    {
      "category_id": "automotive.vehicle_parts_accessories.automotive_lighting_electrical_parts",
      "tier": "decomposition",
      "status": "deferred",
      "reason": "EVIDENCE_RECORD_MISSING",
      "evidence": null
    },
    {
      "category_id": "automotive.vehicle_parts_accessories.automotive_oils_fluids",
      "tier": "decomposition",
      "status": "deferred",
      "reason": "EVIDENCE_RECORD_MISSING",
      "evidence": null
    },
    {
      "category_id": "automotive.vehicle_parts_accessories.brake_parts",
      "tier": "decomposition",
      "status": "deferred",
      "reason": "EVIDENCE_RECORD_MISSING",
      "evidence": null
    },
    {
      "category_id": "automotive.vehicle_parts_accessories.cooling_climate_control_parts",
      "tier": "decomposition",
      "status": "deferred",
      "reason": "EVIDENCE_RECORD_MISSING",
      "evidence": null
    },
    {
      "category_id": "automotive.vehicle_parts_accessories.electric_vehicle_charging_equipment",
      "tier": "decomposition",
      "status": "deferred",
      "reason": "EVIDENCE_RECORD_MISSING",
      "evidence": null
    },
    {
      "category_id": "automotive.vehicle_parts_accessories.emergency_roadside_equipment",
      "tier": "decomposition",
      "status": "deferred",
      "reason": "EVIDENCE_RECORD_MISSING",
      "evidence": null
    },
    {
      "category_id": "automotive.vehicle_parts_accessories.engine_powertrain_parts",
      "tier": "decomposition",
      "status": "deferred",
      "reason": "EVIDENCE_RECORD_MISSING",
      "evidence": null
    },
    {
      "category_id": "automotive.vehicle_parts_accessories.exhaust_emissions_parts",
      "tier": "decomposition",
      "status": "deferred",
      "reason": "EVIDENCE_RECORD_MISSING",
      "evidence": null
    },
    {
      "category_id": "automotive.vehicle_parts_accessories.routine_maintenance_parts",
      "tier": "decomposition",
      "status": "deferred",
      "reason": "EVIDENCE_RECORD_MISSING",
      "evidence": null
    },
    {
      "category_id": "automotive.vehicle_parts_accessories.steering_suspension_parts",
      "tier": "decomposition",
      "status": "deferred",
      "reason": "EVIDENCE_RECORD_MISSING",
      "evidence": null
    },
    {
      "category_id": "automotive.vehicle_parts_accessories.towing_cargo_trailer_accessories",
      "tier": "decomposition",
      "status": "deferred",
      "reason": "EVIDENCE_RECORD_MISSING",
      "evidence": null
    },
    {
      "category_id": "automotive.vehicle_parts_accessories.vehicle_exterior_accessories",
      "tier": "decomposition",
      "status": "deferred",
      "reason": "EVIDENCE_RECORD_MISSING",
      "evidence": null
    },
    {
      "category_id": "automotive.vehicle_parts_accessories.vehicle_interior_accessories",
      "tier": "decomposition",
      "status": "deferred",
      "reason": "EVIDENCE_RECORD_MISSING",
      "evidence": null
    },
    {
      "category_id": "automotive.vehicle_parts_accessories.vehicle_maintenance_detailing_supplies",
      "tier": "decomposition",
      "status": "deferred",
      "reason": "EVIDENCE_RECORD_MISSING",
      "evidence": null
    },
    {
      "category_id": "beauty_personal_care.hair_care.hair_color",
      "tier": "decomposition",
      "status": "deferred",
      "reason": "EVIDENCE_RECORD_MISSING",
      "evidence": null
    },
    {
      "category_id": "beauty_personal_care.hair_care.hair_styling_products",
      "tier": "decomposition",
      "status": "deferred",
      "reason": "EVIDENCE_RECORD_MISSING",
      "evidence": null
    },
    {
      "category_id": "beauty_personal_care.hair_care.hair_treatments_masks",
      "tier": "decomposition",
      "status": "deferred",
      "reason": "EVIDENCE_RECORD_MISSING",
      "evidence": null
    },
    {
      "category_id": "beauty_personal_care.hygiene_toiletries.bath_products",
      "tier": "decomposition",
      "status": "deferred",
      "reason": "EVIDENCE_RECORD_MISSING",
      "evidence": null
    },
    {
      "category_id": "beauty_personal_care.make_up_cosmetics.eye_brow_makeup",
      "tier": "decomposition",
      "status": "deferred",
      "reason": "EVIDENCE_RECORD_MISSING",
      "evidence": null
    },
    {
      "category_id": "beauty_personal_care.make_up_cosmetics.face_makeup",
      "tier": "decomposition",
      "status": "deferred",
      "reason": "EVIDENCE_RECORD_MISSING",
      "evidence": null
    },
    {
      "category_id": "beauty_personal_care.make_up_cosmetics.lip_makeup",
      "tier": "decomposition",
      "status": "deferred",
      "reason": "EVIDENCE_RECORD_MISSING",
      "evidence": null
    },
    {
      "category_id": "beauty_personal_care.make_up_cosmetics.makeup_brushes_applicators",
      "tier": "decomposition",
      "status": "deferred",
      "reason": "EVIDENCE_RECORD_MISSING",
      "evidence": null
    },
    {
      "category_id": "beauty_personal_care.make_up_cosmetics.nail_cosmetics",
      "tier": "decomposition",
      "status": "deferred",
      "reason": "EVIDENCE_RECORD_MISSING",
      "evidence": null
    },
    {
      "category_id": "beauty_personal_care.oral_care.dental_floss_interdental_care",
      "tier": "decomposition",
      "status": "deferred",
      "reason": "EVIDENCE_RECORD_MISSING",
      "evidence": null
    },
    {
      "category_id": "beauty_personal_care.oral_care.mouthwash_breath_care",
      "tier": "decomposition",
      "status": "deferred",
      "reason": "EVIDENCE_RECORD_MISSING",
      "evidence": null
    },
    {
      "category_id": "beauty_personal_care.oral_care.toothbrushes",
      "tier": "decomposition",
      "status": "deferred",
      "reason": "EVIDENCE_RECORD_MISSING",
      "evidence": null
    },
    {
      "category_id": "beauty_personal_care.oral_care.toothpaste",
      "tier": "decomposition",
      "status": "deferred",
      "reason": "EVIDENCE_RECORD_MISSING",
      "evidence": null
    },
    {
      "category_id": "beauty_personal_care.personal_care_appliances",
      "tier": "decomposition",
      "status": "deferred",
      "reason": "EVIDENCE_RECORD_MISSING",
      "evidence": null
    },
    {
      "category_id": "beauty_personal_care.personal_care_appliances.beauty_skin_care_devices",
      "tier": "decomposition",
      "status": "deferred",
      "reason": "EVIDENCE_RECORD_MISSING",
      "evidence": null
    },
    {
      "category_id": "beauty_personal_care.personal_care_appliances.hair_dryers",
      "tier": "decomposition",
      "status": "deferred",
      "reason": "EVIDENCE_RECORD_MISSING",
      "evidence": null
    },
    {
      "category_id": "beauty_personal_care.personal_care_appliances.hair_removal_devices",
      "tier": "decomposition",
      "status": "deferred",
      "reason": "EVIDENCE_RECORD_MISSING",
      "evidence": null
    },
    {
      "category_id": "beauty_personal_care.personal_care_appliances.hair_styling_appliances",
      "tier": "decomposition",
      "status": "deferred",
      "reason": "EVIDENCE_RECORD_MISSING",
      "evidence": null
    },
    {
      "category_id": "beauty_personal_care.shaving_grooming.electric_shavers_trimmers",
      "tier": "decomposition",
      "status": "deferred",
      "reason": "EVIDENCE_RECORD_MISSING",
      "evidence": null
    },
    {
      "category_id": "beauty_personal_care.shaving_grooming.razors_replacement_blades",
      "tier": "decomposition",
      "status": "deferred",
      "reason": "EVIDENCE_RECORD_MISSING",
      "evidence": null
    },
    {
      "category_id": "beauty_personal_care.shaving_grooming.shaving_preparations",
      "tier": "decomposition",
      "status": "deferred",
      "reason": "EVIDENCE_RECORD_MISSING",
      "evidence": null
    },
    {